{
  "title": "她记忆里的童年，先是饭香，再是母亲忙碌的身影",
  "piece_type": "memory_fragment",
  "summary_focus": {
    "main_focus": "童年家庭氛围与母亲的勤劳",
    "primary_people": ["母亲", "父亲"],
    "primary_places": ["小时候的家"],
    "primary_emotions": ["怀念", "敬畏", "温暖"],
    "unexpanded_threads": ["搬家后的变化"]
  },
  "narrative_draft": "她回忆起小时候的家，最先浮现出来的并不是贫穷本身，而是一种始终热热闹闹的生活气息。房子不大，家里人却多，于是日子总像挤在一起往前走。母亲是这个家里最忙的人，天还没亮就起身做饭，到了晚上还要继续做针线。在她的记忆里，母亲似乎总没有真正停下来过。\n\n有意思的是，当她今天回头去想那段童年，最先想到的并不是“苦”，而是家里总有饭香。那种气味像是把整个日子都连在了一起，也让原本拮据的生活多了一层温热。相比之下，父亲的形象则更安静也更有分量——他话不多，性子严，让她小时候有些怕，但家里的大事又总离不开他。\n\n她还提到后来家里搬过一次家，搬家之后很多东西都变了。只是这一层变化，在这次讲述里还没有完全展开，像是一段留在后面的故事。",
  "quotes": [
    "我妈特别能干，天还没亮就起来做饭。",
    "我现在一想到小时候，先想到的倒不是苦，是那个家里总有饭香。",
    "我爸话不多，人很严，我小时候其实有点怕他。",
    "后来我们搬过一次家，搬了以后很多东西都不一样了。"
  ],
  "entities": {
    "people": [
      {
        "name": "母亲",
        "role": "家庭核心人物",
        "description": "勤快能干，长期承担家务劳动"
      },
      {
        "name": "父亲",
        "role": "家庭权威人物",
        "description": "少言、严厉，负责家中大事"
      }
    ],
    "places": [
      {
        "name": "小时候的家",
        "description": "房子不大，但家里人多，很热闹"
      }
    ],
    "times": [
      {
        "label": "小时候",
        "specificity": "low"
      }
    ],
    "events": [
      {
        "name": "童年家庭生活",
        "description": "围绕贫穷、热闹、母亲忙碌与饭香展开"
      },
      {
        "name": "搬家",
        "description": "后续人生变化的转折点之一",
        "status": "unexpanded"
      }
    ]
  },
  "emotional_signals": [
    {
      "emotion": "怀念",
      "evidence": "回忆童年时首先想起饭香与家中的日常"
    },
    {
      "emotion": "敬畏",
      "evidence": "提到父亲时说小时候有些怕他"
    },
    {
      "emotion": "温暖",
      "evidence": "虽然贫穷，但整体记忆基调并不苦涩"
    }
  ],
  "needs_clarification": [
    {
      "field": "搬家发生的时间",
      "reason": "只提到搬家，但没有具体年龄、年份或原因"
    },
    {
      "field": "父亲的具体事件",
      "reason": "提到父亲严厉，但缺少具体例子"
    }
  ],
  "follow_up_questions": [
    "你刚才提到母亲特别能干，我还想听一件最能代表她的事。",
    "你说小时候最先想到的是饭香，那时候家里最常做的饭菜是什么？",
    "你提到父亲很严，有没有一件事让你到现在还记得他的样子？",
    "你说后来搬家以后很多东西都变了，最大的变化是什么？"
  ],
  "source_quality": {
    "clarity": "high",
    "coherence": "high",
    "audio_issues": [],
    "confidence_note": "内容集中，已能形成完整片段稿，但仍有若干待展开线索"
  }
}
